7.7,Clear desk and clear screen,Enforce strict habits requiring workers to stow sensitive paperwork safely and enforce screen lockouts when moving away from desks.,PE-18,Location of System Components,"Situate endpoint stations to block shoulder surfing, configuring automated idle locks on all display outputs.","Partial. ISO 7.7 places emphasis on human workspace sorting habits (desks), while NIST PE-18 focuses heavily on technical configuration policies and physical hardware placement rules."
7.8,Equipment siting and protection,Position and isolate operational hardware elements to prevent damage from environmental factors and reduce line-of-sight exposure.,PE-18,Location of System Components,Position critical processing equipment inside protected inner structural nodes to deny unauthorized visibility and reach.,"Full. Both ensure that target hardware is strategically placed in low-risk zones rather than public-facing, exposed areas."
7.9,Security of assets off-premises,"Enforce tracking, authorization, and technical protection models for any organizational processing gear utilized outside company facilities.",PE-17,Alternative Work Site,Validate and mandate baseline physical security protections for systems deployed in alternative workspaces or external locations.,Full. Both address the extension of internal security baselines to cover assets operating outside the physical protection of the main corporate office.
7.10,Storage media,"Manage the complete tracking lifecycle, encryption, and secure handling of portable storage drives, tapes, and disks.",MP-4,Media Storage,"Physically secure, inventory, and restrict access to physical and digital data storage units inside designated control parameters.",Full. Both frameworks prioritize tracking and guarding physical storage blocks to stop simple physical data extraction exploits.
7.11,Supporting utilities,"Insulate hardware setups from power infrastructure failure by implementing backup generators, UPS systems, and steady telecom lines.",PE-11,Emergency Power,"Deploy secondary, localized power supply mechanics to maintain technical operations during baseline utility failure grid events.","Partial. ISO 7.11 includes water and HVAC utility support under one umbrella, whereas NIST provides separate controls for backup emergency electricity (PE-11) and HVAC systems (PE-14)."
7.12,Cabling security,"Shield and physically route power, network connectivity, and data lines to prevent active wiretapping, physical intercepts, or sabotage.",PE-9,Power Equipment and Cabling,"Construct physical conduits, floor pathways, and underground routings to secure communication cables against tampering or destruction.",Full. Both target protecting network and electrical copper/fiber connections from simple physical cutting or electronic intercept actions.
7.13,Equipment maintenance,Perform regular maintenance on information systems and supporting structures in accordance with manufacturer parameters to ensure availability.,PE-12,Component Servicing,"Schedule, authorize, and audit system hardware maintenance activities, ensuring repair workers are fully authenticated.","Partial. ISO 7.13 focuses heavily on operational uptime and general system health, while NIST PE-12 mandates explicit pre-authorization protocols for maintenance personnel and technical tools brought on-site."
7.14,Secure disposal or re-use of equipment,"Decommission, wipe, and process hardware nodes to ensure that no residual corporate information remains on devices prior to disposal.",MP-6,Media Sanitization,"Utilize verified physical destruction, degaussing, or deep logical overwriting methods to eliminate remaining data on retiring media.","Full. Both mandate advanced cryptographic wiping or physical destruction methods to prevent data leakage from obsolete, discarded hardware assets."
8.1,User endpoint devices,"Enforce strict device configuration matrices, endpoint encryption, and compliance checking on mobile and station units.",AC-19,Access Control for Mobile Devices,"Establish usage policies, connection parameters, and mandatory full-disk encryption for portable technology computing platforms.","Partial. ISO 8.1 encompasses stationary office workstations and corporate endpoints holistically, while NIST AC-19 is focused specifically on portable, high-risk wireless and mobile devices."
8.2,Privileged access rights,"Limit, audit, and systematically control elevated account rights (such as root or domain admin) to prevent widespread exploit impacts.",AC-6,Least Privilege,Enforce explicit technical settings to limit user and tool roles to the minimum functional access necessary for tasks.,Full. Both are designed to prevent credential amplification by locking down admin profiles and tracking their usage patterns tightly.
8.3,Information access restriction,"Apply file, directory, and system access blocks that filter user execution capabilities based on business role mapping.",AC-3,Access Enforcement,Deploy system access control lists (ACLs) to logically approve or deny interaction requests with system objects.,"Full. Both mandate the utilization of system enforcement points to block unauthorized read, write, and execute attempts on corporate data assets."
8.4,Access to source code,"Isolate, protect, and restrict read and write capability over proprietary application source code repositories to prevent exploitation.",SA-11,Developer Security Testing and Evaluation,Restrict developer environments and enforce code repository controls to prevent unauthorized injections and code alterations.,"Partial. ISO 8.4 is a highly explicit access control requirement for source code repositories, whereas NIST addresses this as a sub-component within broad system development and supply chain engineering controls (SA family)."
8.5,Secure authentication,"Incorporate multi-factor verification mechanisms, robust cryptographic secrets, and continuous signal checks before granting entry.",IA-2,Identification and Authentication (Organizational Users),"Require cryptographically sound multi-factor authentication models for network, local, and administrative account verification.","Full. Both controls enforce the technical death of single-factor password authentication, mandating separate verification steps (biometrics, physical tokens)."
8.6,Capacity management,"Monitor system capacity usage patterns, projecting storage, network, and processing requirements to maintain continuity.",SC-6,Resource Availability,Configure resource allocation limits and performance monitors to protect compute infrastructure against starvation and denial of service.,Full. Both prevent infrastructure exhaustion by setting active baselines and alerting on threshold breaches before service collapse occurs.
8.7,Protection against malware,Integrate real-time behavioral and signature scanning software engines across endpoints and entryways to eliminate rogue applications.,SI-3,Malicious Code Protection,"Deploy and automatically update server and endpoint protective modules to actively scan for and isolate viruses, trojans, and malicious macros.","Full. Both mandate automated, systemic anti-malware operations to catch malicious files before execution inside network zones."
8.8,Management of technical vulnerabilities,"Execute regular infrastructure scanning, assess severity metrics, and implement missing security patches within established time limits.",RA-5,Vulnerability Monitoring and Scanning,"Utilize automated vulnerability scanners to probe system interfaces, compile missing patch maps, and remediate flaw exposures.","Partial. ISO 8.8 outlines the full operational management cycle of remediation and patch tracking, while NIST RA-5 details the explicit technical parameters and frequencies of automated scanning execution."
8.9,Configuration management,"Establish, audit, and systematically manage secure configuration baselines for all network, software, and hardware configurations.",CM-2,Baseline Configuration,"Develop, document, and maintain a high-fidelity baseline architecture state to guide secure system provisioning and modification.","Full. Both prevent security erosion by requiring that all systems conform to an official, tightly audited, non-default configuration state."
8.10,Information deletion,"Configure database and file system features to permanently purge digital records when no longer needed, bypassing residual recovery.",SI-12,Information Residual Representation and Protection,Ensure that logical data allocations and memory blocks are purged completely to prevent subsequent users from reading residual bits.,Full. Both address the technical prevention of data mining exploits that target unallocated sectors or poorly deleted storage objects.
8.11,Data masking,"Apply obfuscation, pseudonymization, or masking techniques to hide sensitive metrics inside non-production or analytics databases.",SC-28,Protection of Information at Rest,"Implement structural protections, column-level encryption, or programmatic data masking to shield data fields from unauthorized views.","Partial. ISO 8.11 explicitly targets data masking for role-based viewing (e.g., hiding PII in test environments), while NIST SC-28 is broadly focused on raw cryptographic security of bulk storage volumes."
8.12,Data leakage prevention,Deploy advanced network filter modules and endpoint agents designed to automatically block outbound movement of classified corporate data.,AC-4,Information Flow Enforcement,Implement technical boundary rule configurations to prevent confidential data payloads from crossing into untrusted external networks.,"Partial. ISO 8.12 focuses heavily on specialized Data Loss Prevention (DLP) tooling and payload inspection, while NIST AC-4 deals with macro information flow architectures and strict zone separation models."
8.13,Information backup,"Generate and securely replicate data copies to isolated repositories, testing restoration routines regularly to guarantee survivability.",CP-9,System Backup,"Execute scheduled system backups encompassing user data, volume states, and security metadata, ensuring offline or immutable storage.","Full. Both require systematic, protected backup generation coupled with verification routines to survive ransomware or catastrophic storage crashes."
8.14,Redundancy of information processing facilities,"Incorporate active structural high-availability, duplicate physical lines, and network pathing options to prevent single-point downtime events.",CP-7,Alternate Processing Site,Deploy operational failover platforms and network routing capacity geographically separate from primary systems to sustain business operations.,"Partial. ISO 8.14 focuses on general clustering and local hardware high availability, while NIST CP-7 details rigorous geographic separation parameters for standby infrastructure zones."
8.15,Logging,"Configure background operating mechanisms to capture distinct user activities, security errors, and transactional activities into logs.",AU-2,Event Logging,"Define exact events, audit parameters, and transactional anomalies that must be logged by components across system layers.",Full. Both mandate the technical establishment of background system audit records to track configuration modifications and trace security incidents.
8.16,Monitoring activities,"Analyze real-time event logs, inbound connection records, and application metrics to detect indicators of malicious behavior.",SI-4,System Monitoring,"Deploy network security monitoring, intrusion detection engines, and event analysis tools to flag unauthorized system behaviors.",Full. Both move beyond simple passive logging to require active technical monitoring frameworks that detect active intrusions.
8.17,Clock synchronization,Synchronize internal timekeepers across all system assets to a master authoritative atomic time reference to preserve forensic accuracy.,AU-8,Time Stamps,"Configure internal system clocks to reference standard external time servers, generating synchronized forensic time stamps for all log entries.",Full. Both understand that accurate forensic timeline recreation during post-incident investigations requires exact clock alignment across all nodes.
8.18,Use of privileged utility programs,Restrict and closely monitor powerful system utilities capable of overriding standard OS file security and control configurations.,AC-6,Least Privilege,Enforce technical access profiles to prevent users from executing dangerous system management tools or low-level utilities.,Full. Both mitigate the danger of structural bypass techniques by strictly limiting access to low-level maintenance utilities.
8.19,Installation of software on operational systems,Configure technical barriers and endpoint restrictions to block users from executing unauthorized software files on production platforms.,CM-7,Least Functionality,Enforce application allowlisting and block unnecessary protocols to ensure systems run only authorized software programs.,"Full. Both require hard administrative or technical filters (like application allowlisting) to block arbitrary, unapproved user code execution."
8.20,Network security,"Govern, separate, and secure data traffic boundaries across corporate communication pathways using advanced technical protections.",SC-7,Boundary Protection,"Deploy network firewalls, packet filters, and traffic management gateways at all external connection interfaces.","Partial. ISO 8.20 represents a broad macro directive for general network engineering security, while NIST SC-7 explicitly outlines granular rules for interface filtering, XML inspection, and proxy placement."
8.21,Security of network services,"Establish strict authorization matrices and encryption layers for specialized communication services like VPNs, DNS, and routing protocols.",SC-7,Boundary Protection,Isolate network services and configure strict security parameters on internal communication gateways to block malicious traffic routing.,Full. Both ensure that ancillary network utilities and carrier protocols are locked down against hijacking or man-in-the-middle attacks.
8.22,Segregation of networks,Partition enterprise communication architecture into isolated logical zones to contain breaches and protect sensitive backend records.,SC-7,Boundary Protection,"Enforce explicit internal subnetting, VLAN separations, and logical isolation zones between corporate and DMZ assets.",Full. Both require network micro-segmentation to ensure a compromise in a public-facing web server does not grant flat lateral access to database segments.
8.23,Web filtering,"Deploy proxy content filters to automatically block browser connections to dangerous, malicious, or unapproved web domains.",SI-4,System Monitoring,"Monitor and intercept user outbound web traffic, utilizing domain filters to block communication with command-and-control servers or malware drops.",Full. Both mandate the active filtering of web traffic to minimize user exposure to drive-by malware downloads and social engineering sites.
8.24,Use of cryptography,"Mandate high-grade encryption algorithms, key distribution mechanisms, and secure lifecycle practices across all corporate architectures.",SC-13,Cryptographic Protection,Leverage validated mathematical cryptographic modules to protect the confidentiality and integrity of classified data blocks.,"Full. Both ensure data confidentiality by mandating approved cryptographic standards (e.g., FIPS 140-validated modules for NIST) across system layers."
8.25,Secure development lifecycle,"Establish mandatory secure software development guidelines, code reviews, and testing milestones for all in-house applications.",SA-3,System Development Life Cycle,Govern software creation processes using an structured lifecycle framework that mandates continuous security engineering reviews.,Full. Both demand that application security features are integrated throughout the development lifecycle rather than being addressed ad-hoc near release.
8.26,Application security requirements,"Analyze and specify individual security criteria, user input validations, and threat profiles when engineering application systems.",SA-4,Acquisition Process,Incorporate explicit technical security specifications and feature requirements directly into design and software acquisition phases.,Full. Both ensure that application architectures are designed from inception to handle malicious inputs and enforce specific security capabilities.
8.27,Secure system architecture and engineering principles,"Apply verified structural architecture principles, including zero-trust design, defense-in-depth, and fail-secure settings during system implementation.",SA-8,Security and Privacy Engineering Principles,"Apply system engineering blueprints based on defense-in-depth, complete mediation, and isolation models to reduce exploit surfaces.","Full. Both mandate moving past ad-hoc security configurations, forcing engineering teams to apply foundational security architecture patterns."
8.28,Secure coding,"Train developers and enforce specific coding practices to block buffer overflows, injection exploits, and logic bugs.",SA-11,Developer Security Testing and Evaluation,"Require developers to perform code analysis, prevent known software vulnerabilities, and follow structured coding standards.","Full. Both target vulnerability elimination at the source by mandating secure coding practices and preventing common security flaws (e.g., OWASP Top 10)."
8.29,Security testing in development and acceptance,"Subject modified applications to static, dynamic, and penetration testing routines prior to pushing code into production status.",SA-11,Developer Security Testing and Evaluation,"Execute explicit vulnerability scanning, regression verification, and security quality checks before authorizing product rollout.",Full. Both require rigorous pre-deployment technical validation to identify design flaws and code openings before code exposure to live threats.
8.30,Outsourced development,"Supervise, audit, and mandate strict compliance with internal secure coding standards when utilizing external software vendors.",SA-12,Supply Chain Risk Management,Apply explicit supply chain checks and developer vetting rules on external third parties building custom software elements.,"Partial. ISO 8.30 centers on monitoring contract software developers, while NIST SA-12 provides a far broader supply chain tracking model including third-party code provenance, tampering, and legal tracking."
8.31,"Separation of development, testing and production environments","Isolate development, testing, and production environments logically and physically to prevent untested code or active bugs from impacting production networks.",SC-7,Boundary Protection,Enforce distinct access boundaries and execution limits to isolate development sandboxes from live production databases.,"Full. Both controls prevent configuration mixing, ensuring that development work and software testing occur completely separate from live transaction spaces."
8.32,Change management,"Subject all systems modifications, environment changes, and updates to formal approval, documentation, and regression testing reviews.",CM-3,Configuration Change Control,"Coordinate, analyze, and track physical and logical updates to the environment using a formal configuration board review mechanism.","Full. Both require rigorous change control procedures to prevent undocumented, rogue, or untested changes from undermining security baselines."
8.33,Test information,"Protect and sanitize testing data, avoiding the utilization of live production PII datasets inside non-production environments.",MP-7,Media Use,"Restrict the use of operational production data in test environments, requiring sanitized or synthetic datasets.",Full. Both prevent data leakage by prohibiting developers from copying live customer PII or transaction histories into less-secure testing sandboxes.
8.34,Protection of information systems during auditing testing,Coordinate and schedule security assessment activities carefully to minimize operational performance impacts and prevent system disruptions.,CA-7,Continuous Monitoring,Manage active control assessment and configuration checking routines so they do not interrupt system operations or degrade core system performance thresholds.,Full. Both require that automated scanning or active manual audit verifications are managed to protect live production environments from accidental downtime.
