ISO 27001:2022 Control ID,ISO 27001:2022 Control Name,ISO Control Summary (Paraphrased),NIST 800-53 Rev 5 Control ID,NIST 800-53 Control Name,NIST Control Summary (Paraphrased),Completeness & Gap Analysis
5.1,Policies for information security,"Establish, approve, and periodically review high-level organizational rules to direct the protection of informational assets.",PL-1,Security Planning Policy and Procedures,Document and distribute formal governance policies establishing organizational rules for security planning and policy baselines.,"Partial. ISO 5.1 acts as a universal directive for all security policies, whereas NIST PL-1 is program-specific, requiring distinct procedures, roles, and implementation details for the planning family."
5.2,Information security roles and responsibilities,Define and allocate specific security responsibilities and authorities throughout the organization to maintain clear accountability.,PM-9,Risk Executive Designation,"Appoint a dedicated individual or governing group to oversee risk assessments, security strategies, and operational accountability.","Partial. ISO 5.2 covers all security roles holistically, while NIST PM-9 focuses explicitly on establishing an enterprise-wide risk executive function connected to corporate governance."
5.3,Segregation of duties,"Separate conflicting operational tasks and responsibilities to minimize risks of unauthorized changes, modification, or fraud.",AC-5,Separation of Duties,Divide sensitive authorizations and duties among different individuals to prevent collusion and systemic abuse of access rights.,Full. Both controls enforce the division of operational duties to eliminate single-point vulnerabilities regarding security or transactional authorization.
5.4,Management responsibilities,"Require executives to visibly support, mandate, and review the execution of information security across all organizational functions.",PM-4,Plan of Action and Milestones Process,"Implement institutional remediation processes driven by management to track, resource, and resolve system security gaps.","Partial. ISO 5.4 emphasizes management's cultural and leadership endorsement, while NIST PM-4 mandates an explicit, documented corrective action plan framework (POA&M) for senior leaders."
5.5,Contact with authorities,"Establish and maintain structured communication channels with relevant regulatory bodies, legal teams, and law enforcement.",IR-6,Incident Reporting,Define strict guidelines and timelines for reporting security incidents and operational breaches to external public entities.,"Partial. ISO 5.5 focuses broadly on general ongoing relational contact with authorities, whereas NIST IR-6 mandates a systematic, structured mechanism for reporting active security compromises."
5.6,Contact with special interest groups,"Engage with professional security associations, industry forums, and knowledge-sharing groups to track emerging threats and standards.",SI-16,Information Sharing,Participate in external bilateral or multilateral information-sharing forums to exchange threat indicators and cybersecurity defensive insights.,Full. Both framework items require active collaboration with peer networks and specialized bodies to ingest external threat intelligence and security best practices.
5.7,Threat intelligence,"Collect, analyze, and process contextual information regarding operational threats to enable proactive risk mitigation and defenses.",RA-3,Risk Assessment,"Identify, assess, and prioritize threat indicators, systemic vulnerabilities, and likelihoods to establish comprehensive technical risk baselines.","Partial. ISO 5.7 emphasizes the ingestion, curation, and dissemination of dynamic threat feeds, while NIST RA-3 focuses on formal, structured internal risk analyses utilizing that data."
5.8,Information security in project management,"Integrate information security criteria, risk evaluations, and guardrails into all phases of organizational project lifecycles.",SA-3,System Development Life Cycle,Incorporate explicit security and privacy engineering requirements directly into the overarching development and project framework.,Full. Both require that security is built into programmatic initiatives from inception rather than being bolted on post-execution.
5.9,Inventory of information and other associated assets,"Develop, document, and maintain an accurate ledger of all corporate processing assets, datasets, and supporting systems.",CM-8,System Component Inventory,"Create and keep updated a granular, continuous inventory tracking all physical and virtual hardware and software elements.","Partial. ISO 5.9 includes intangible informational assets (intellectual property, records), whereas NIST CM-8 is highly technical, focusing primarily on hardware, virtual nodes, and physical modules."
5.10,Acceptable use of information and other associated assets,Formulate and mandate clear guidelines detailing permitted operational behaviors and restrictions regarding corporate assets.,PL-4,Rules of Behavior,"Establish, disseminate, and obtain explicit user acknowledgments regarding rules governing system usage and administrative privileges.",Full. Both ensure that end-users and administrators are bound by formal behavioral parameters when operating company-owned resources.
5.11,Return of assets,"Ensure all workers hand back company-owned hardware, data storage, and documentation upon termination or transfer.",PS-4,Personnel Termination,"Execute offboarding checklists that require retrieval of keys, credentials, tokens, and corporate information devices from departing staff.",Full. Both manage the technical and physical reclaim of organizational properties during an employee or contractor offboarding workflow.
5.12,Classification of information,Categorize data assets into distinct tiers based on confidentiality requirements and potential organizational harm from disclosure.,RA-2,Security Categorization,"Classify organizational processing systems and data files using explicit low, medium, or high impact metrics regarding core confidentiality, integrity, and availability.","Partial. ISO 5.12 focuses heavily on labeling arbitrary file contents, whereas NIST RA-2 applies a rigorous system-boundary analysis mapped to federal impact thresholds."
5.13,Labelling of information,"Implement an active, standardized metadata or physical tagging system to denote the sensitivity level of processed data.",MP-3,Media Marking,"Affix clear, unambiguous security markings on electronic and physical media storage components reflecting system impact levels.",Full. Both require clear visual or logical indicators on data packages and storage media to guide users in appropriate handling behaviors.
5.14,Information transfer,"Establish formal policies, protocols, and technical agreements to secure the transmission of data to external parties.",AC-4,Information Flow Enforcement,Deploy system configurations and filters that restrict data movements between interconnected nodes based on defined security policies.,"Partial. ISO 5.14 focuses extensively on administrative mechanisms like data transfer agreements (DPAs), while NIST AC-4 mandates technical rule-based controls to block unauthorized data routing."
5.15,Access control,Govern and limit logical permissions allowing users or services to interact with specific enterprise systems and data assets.,AC-3,Access Enforcement,Configure automated security mechanisms to enforce logical access parameters across system boundaries based on official access rules.,"Partial. ISO 5.15 outlines overall policy goals for access restrictions, whereas NIST AC-3 details specific technical enforcement strategies (e.g., RBAC, ABAC) within system architectures."
5.16,Identity management,"Control the full lifecycle of corporate identities, ensuring unique accounts are allocated to authorized entities.",IA-2,Identification and Authentication (Organizational Users),Uniquely identify and authenticate all internal network actors before granting logical access to operational boundaries.,"Full. Both ensure that every user profile is tied back to a singular, verifiable individual or service principal to preserve accountability."
5.17,Authentication information,"Enforce strict management rules regarding the creation, allocation, modification, and protection of verification secrets like passwords and tokens.",IA-5,Authenticator Management,"Establish systemic rules for managing secrets, including length, complexity, rotation schedules, and security during storage and transmit.","Full. Both control frameworks govern the security, distribution, and operational maintenance of verification factors and secrets."
5.18,Access rights,"Provision, adjust, and revoke application and database access privileges in strict alignment with authorization policies.",AC-2,Account Management,"Monitor, authorize, and systematically audit user account states, changes, creations, suspensions, and termination workflows.","Full. Both address the active, ongoing lifecycle administration of user credentials and specific data privilege schemes."
5.19,Information security in supplier relationships,Define and communicate the organization's explicit security requirements to all third-party vendors accessing enterprise environments.,SR-2,Supply Chain Risk Management Policy and Procedures,"Establish organizational structures, policies, and analytical models to minimize technology supply chain threats and vendor exposure.","Partial. ISO 5.19 focuses on immediate business vendor agreements, whereas NIST SR-2 establishes a macro-level Supply Chain Risk Management (SCRM) program targeting deep counterfeit and provenance tracking."
5.20,Addressing information security within supplier agreements,"Embed enforceable, contractually binding security commitments into all service level agreements and vendor contracts.",SR-5,Acquisition Strategies / Tools / Methods,Incorporate clear security performance requirements and evaluation criteria into acquisition documentation and legal procurement channels.,Full. Both require the inclusion of legal and administrative compliance clauses within purchasing contracts to enforce partner liability.
5.21,Managing information security in the ICT supply chain,"Analyze and track risks downstream through the tech supply chain, encompassing manufacturing, software development, and cloud integration.",SR-3,Supply Chain Controls and Processes,"Execute specialized technical assessments, code reviews, and physical integrity verifications for components throughout the procurement lifecycle.","Partial. ISO 5.21 mandates basic risk management for tech supply, while NIST SR-3 outlines exhaustive, granular operations including anti-counterfeiting, tamper detection, and component tracking."
5.22,"Monitoring, review and change management of supplier services","Routinely audit, assess, and manage alterations in third-party service delivery to ensure continuous adherence to contract terms.",SR-6,Supplier Assessments and Reviews,"Conduct regular technical assessments, reviews, and audits of technology suppliers to confirm adherence to security baselines.",Full. Both establish operational routines to actively audit vendor performance against security obligations rather than relying solely on point-in-time checks.
5.23,Information security for use of cloud services,"Establish distinct parameters for cloud configuration, shared responsibility alignment, and operational governance of multi-tenant environments.",SA-9,External System Services,"Oversee, authorize, and audit the usage of external information systems, ensuring equivalent internal baseline controls are applied.","Partial. ISO 5.23 treats cloud computing as a distinct structural scenario needing clear shared governance, while NIST SA-9 treats it under the broader category of any external hosted platform service."
5.24,Information security incident management planning and preparation,"Formulate comprehensive structures, team responsibilities, and playbook baselines to ensure ready execution during a cyber incident.",IR-1,Incident Response Policy and Procedures,"Establish operational blueprints, coordination directives, and programmatic infrastructure for enterprise incident resolution.","Full. Both require the formal structural creation of incident response capabilities, communication pathways, and procedural readiness."
5.25,Assessment and decision on information security events,Evaluate operational anomalies and security signals to accurately categorize them and declare official incident status if warranted.,IR-4,Incident Handling,"Execute real-time identification, sorting, technical triage, and dynamic analysis of system indicators to handle active anomalies.",Full. Both mandate a logical triage process to distinguish benign system errors from adversarial activity requiring emergency response escalation.
5.26,Response to information security incidents,"Deploy containment, eradication, and system recovery activities to neutralize active threats in accordance with operational procedures.",IR-4,Incident Handling,"Perform containment, coordination, tactical recovery, and internal evidence preservation when managing an operational exploit.",Full. Both mandate technical containment steps to isolate threats and system restoration actions to return the company to steady state operations.
5.27,Learning from information security incidents,"Analyze resolved security breaches to extract root causes, updating security parameters and training to prevent future reoccurrences.",IR-8,Incident Lessons Learned,Conduct post-incident reviews to document systemic vulnerabilities exploited and integrate changes into defensive baselines.,Full. Both ensure that security incidents serve as corrective feedback mechanisms to harden institutional defense layers.
5.28,Collection of evidence,Secure and preserve digital forensic material and chain of custody data following an incident to support legal or internal reviews.,IR-7,Incident Response Assistance,"Establish internal resources or expert forensic capabilities to capture artifacts, preserve volatile memory, and document breach metrics.","Partial. ISO 5.28 focuses heavily on meeting standard judicial criteria for evidence admissibility, whereas NIST IR-7 highlights providing general engineering support during analytical procedures."
5.29,Information security during disruption,"Maintain baseline security continuity and information controls during a disaster, emergency, or business interruption event.",CP-2,Contingency Plan,"Develop and execute detailed plans describing fallback procedures, roles, and technical architectures during system failovers.","Partial. ISO 5.29 mandates that security protections remain functional *during* a crisis, whereas NIST CP-2 provides the exhaustive operational manual for system recovery itself."
5.30,ICT readiness for business continuity,"Ensure information systems possess structural availability, redundant capacity, and failover validation to fulfill recovery time objectives.",CP-6,Alternate Storage Site,Configure and establish distinct geometric backup locations equipped with proper environmental and technical safeguards.,"Partial. ISO 5.30 is a high-level technical capability requirement for comprehensive continuity, whereas NIST CP-6 specifies the explicit setup parameters for an alternate storage center."
5.31,"Legal, statutory, regulatory and contractual requirements","Identify and map all relevant legislative mandates, contract conditions, and regulatory environments to ensure security design compliance.",PM-4,Plan of Action and Milestones Process,"Oversee corporate mapping and funding lines to ensure systemic adherence with public laws, statutory policies, and regulatory guidelines.","Partial. ISO 5.31 requires cataloging the compliance matrix, while NIST maps these through the overarching enterprise Program Management (PM) controls which connect compliance directly to budget and mission."
5.32,Intellectual property rights,"Deploy procedural safeguards to prevent illicit utilization, sharing, or replication of copyrighted or proprietary material.",PM-19,Leveraging Proprietary and Open-Source Software,"Establish formal risk frameworks governing usage restrictions, licenses, and rights assessments across the enterprise.",Full. Both ensure software and technical architectures adhere to intellectual property rules and avoid illegal utilization of code.
5.33,Protection of records,"Secure internal operational records against unauthorized destruction, modification, or falsification in compliance with retention mandates.",MP-6,Media Sanitization,Safeguard corporate records and system media from unauthorized reading or extraction using rigorous destruction techniques.,"Partial. ISO 5.33 centers on standard business record retention and structural integrity, while NIST MP-6 targets specific media disposal and data wiping technologies."
5.34,Privacy and protection of PII,"Configure technical structures and organizational policy settings to isolate, protect, and process personally identifiable data legally.",PM-20,Privacy Program Management,"Implement an institutional privacy office, framework, and accountability metrics to map and monitor PII workflows.","Partial. ISO 5.34 outlines security protection for personal data inside the ISMS, while NIST Rev 5 incorporates a comprehensive parallel framework of dedicated Privacy Controls (PT/PM families) that go far deeper into privacy rights."
5.35,Independent review of information security,"Subject the entire enterprise security environment and control frameworks to scheduled, unbiased third-party or independent internal audits.",CA-2,Control Assessments,Appoint impartial assessors to formally audit and test systemic control efficacy to uncover systemic configuration flaws.,"Full. Both require an uncompromised, objective evaluation of control health by personnel independent of system management."
5.36,Compliance with policies and standards for information security,"Regularly audit individual system administrators, configurations, and network environments to confirm tight alignment with corporate baselines.",CA-7,Continuous Monitoring,Implement structural automated solutions to perform perpetual configuration scanning and ongoing validation of control states.,"Partial. ISO 5.36 favors point-in-time reviews and operational check routines, whereas NIST CA-7 requires dynamic, ongoing automated continuous monitoring mechanisms."
5.37,Documented operating procedures,"Formulate and maintain explicit, written step-by-step instructions for managing system operations and daily IT workflows.",CM-9,Configuration Management Plan,Develop detailed administrative roadmaps and operational guidelines for managing modifications and running core architectures.,"Full. Both ensure that technical maintenance, changes, and system activities are driven by documented processes rather than informal, unverified ad-hoc habits."
6.1,Screening,"Conduct systematic identity, criminal background, and historical background verifications on candidate personnel before formal hiring.",PS-3,Personnel Screening,Apply proportional vetting and security clearance criteria to individuals prior to granting technical access to organizational boundaries.,Full. Both controls attempt to minimize internal risk vectors by verifying employee backgrounds before introducing them into systems.
6.2,Terms and conditions of employment,"Enforce explicit contractual clauses defining a worker's personal security obligations, continuing indefinitely past their active tenure.",PS-6,Access Agreements,"Secure formal user signatures on acceptable use, confidentiality, and behavioral agreements before provision of user accounts.",Full. Both manage the administrative framework that establishes legally binding security accountability on the individual worker.
6.3,"Information security awareness, education and training","Deliver continuous threat briefings, phishing mock tests, and baseline security habits training to all corporate workforce units.",AT-2,Literacy Training and Awareness,"Disseminate broad security awareness material focused on general infrastructure hygiene, social engineering tactics, and modern exploit vectors.",Full. Both focus on human error mitigation by requiring mandatory ongoing security literacy tracks for standard users.
6.4,Disciplinary process,"Establish a formalized administrative process to penalize, suspend, or terminate employees who intentionally violate security guidelines.",PS-8,Personnel Sanctions,Operationalize corporate penalty structures to address deliberate non-compliance or accidental compromises of internal policies.,"Full. Both require clear, authoritative avenues for HR and Security to take formal corrective and punitive action against rule-breakers."
6.5,Responsibilities after termination or change of employment,"Define, communicate, and track individual security obligations that remain legally active after a resource departs the company.",PS-4,Personnel Termination,"Conduct exit briefings to reinforce remaining non-disclosure obligations, immediately cutting off physical and logical access paths.","Full. Both manage the final exit stage of human risk, ensuring credentials are wiped and long-term secrets remain legally protected."
6.6,Confidentiality or non-disclosure agreements,"Require legally binding non-disclosure pledges to protect proprietary data assets, signed by all workers and contract partners.",PS-6,Access Agreements,"Require users to sign official, legally vetted confidentiality contracts prior to exposing them to internal system resources.",Full. Both ensure information protection by wrapping system exposure in enforceable corporate non-disclosure mandates.
6.7,Remote working,"Deploy specific endpoint baselines, connection protocols, and physical tracking rules to defend data processed outside formal offices.",AC-17,Remote Access,"Enforce strict encryption, gateway architectures, and explicit management tracking for data flows originating from external networks.","Partial. ISO 6.7 contains broad operational/physical criteria for work-from-home settings, whereas NIST AC-17 details specific encryption protocols (e.g., managed VPNs, TLS) and architectural gateway configurations."
6.8,Information security event reporting,"Mandate and simplify procedures for workforce units to instantly flag observed system anomalies, bugs, or suspicious incidents.",IR-6,Incident Reporting,Configure internal channels allowing personnel to easily report emerging system vulnerabilities or potential indicators of compromise.,Full. Both controls seek to shorten detection times by empowering standard employees to function as active security detection points.
7.1,Physical security perimeters,"Construct robust external structures, perimeter walls, and physical barriers around campus zones handling internal data systems.",PE-3,Physical Access Control,"Enforce hard structural perimeters, facility fences, and guarded boundaries to strictly filter incoming human traffic.",Full. Both frameworks rely on structural architecture and perimeter containment to baseline the security of physical facilities.
7.2,Physical entry,"Restrict portal entry across facilities to authorized personnel using electronic locks, badges, or manned guard stations.",PE-3,Physical Access Control,"Leverage badges, multi-factor electronic locks, or visitor logging procedures at perimeter access portals to grant facility entry.",Full. Both require real-time validation of individual identity before permitting physical passage through facility access doors.
7.3,"Securing offices, rooms and facilities","Design, separate, and lock inner office suites and specific equipment rooms to prevent unauthorized deep penetration into sites.",PE-4,Access Control for Transmission Medium,Implement distinct interior structural boundaries to separate open common spaces from sensitive processing cores or data rooms.,"Full. Both demand multi-tiered internal physical isolation, ensuring that gaining access to the main lobby does not grant access to data centers."
7.4,Physical security monitoring,"Deploy active surveillance networks, intruder alarms, and closed-circuit video setups to track building grounds continuously.",PE-6,Physical Access Monitoring,"Utilize video systems, physical sensors, and centralized alarms to observe and record unauthorized movements across facility grounds.",Full. Both mandate continuous visual or electronic monitoring of facility boundaries to instantly capture physical intrusions.
7.5,Protecting against physical and environmental threats,"Incorporate industrial protective frameworks against natural forces like fire, flooding, seismic activity, and physical sabotage.",PE-13,Environmental Controls,"Integrate suppression tools, smoke detectors, water dams, and structured building reinforcement to preserve infrastructure integrity.","Partial. ISO 7.5 merges physical and environmental threats broadly, whereas NIST splits these into highly dedicated controls for fire protection (PE-13), temperature (PE-14), and water damage (PE-15)."
7.6,Working in secure areas,Establish rigid operational procedures and strict monitoring parameters for personnel performing tasks inside high-security zones.,PE-2,Physical Access Authorizations,Develop authorized access logs and behavior protocols for staff specifically permitted within restricted hardware rooms.,Full. Both topic areas cover controlling personnel activities inside restricted or core mechanical layers.
